<?xml version="1.0" encoding="utf-8" ?> 
<combatantdata xmlns:xsi="http://www.w3.org/2001/XMLSchema-instance" xmlns="CombatantConfig" xsi:schemaLocation="CombatantConfig combatant.xsd">

  <!--
    The sets of equipment that a combatant could be wearing
    x and y are position of item, as given by InventoryLayout.cs
        Inventory properties are stored in a grid like
        +=+=+===+=====+
        |g|h|f f|b b b|
        +=+=+===+     |
        |a a a a|b b b|
        + +===+ +     |
        |a|c c|a|b b b|
        +=+=+=+=+=+===+
        |d d|e e|i|   |
        +===+===+=+===+
        where
            a = belt
            b = backpack
            c = right shoulder
            d = right leg
            e = left shoulder
            f = left leg
            g = right hand
            h = left hand
            i = armor
-->
  <loadout name="Sampling">
    <item name="ITEM_STUN_LAUNCHER" x="0" y="0" />
    <item name="ITEM_PSIONIC_PROBE" x="1" y="0" />
    <item name="ITEM_STUN_BOMB"     x="4" y="0" />
    <item name="ITEM_STUN_BOMB"     x="5" y="0" />
    <item name="ITEM_STUN_BOMB"     x="6" y="0" />
  </loadout>
  <loadout name="LightPlasma">
    <item name="ITEM_PLASMA_PISTOL"      x="0" y="0" />
    <item name="ITEM_PLASMA_PISTOL_CLIP" x="2" y="3" />
    <item name="ITEM_ALIEN_GRENADE"      x="1" y="2" />
    <item name="ITEM_ALIEN_GRENADE"      x="2" y="2" />
  </loadout>
  <loadout name="MediumPlasma">
    <item name="ITEM_PLASMA_RIFLE"      x="0" y="0" />
    <item name="ITEM_PLASMA_RIFLE_CLIP" x="2" y="3" />
    <item name="ITEM_ALIEN_GRENADE"     x="1" y="2" />
    <item name="ITEM_ALIEN_GRENADE"     x="2" y="2" />
  </loadout>
  <loadout name="HeavyPlasma">
    <item name="ITEM_HEAVY_PLASMA_RIFLE"      x="0" y="0" />
    <item name="ITEM_HEAVY_PLASMA_RIFLE_CLIP" x="2" y="3" />
    <item name="ITEM_ALIEN_GRENADE"           x="1" y="2" />
    <item name="ITEM_ALIEN_GRENADE"           x="2" y="2" />
  </loadout>
  <loadout name="Grav">
    <item name="ITEM_GRAVITY_DISTORTION_LAUNCHER" x="0" y="0" />
    <item name="ITEM_GRAVITY_DISTORTION_DRONE"    x="4" y="0" />
    <item name="ITEM_GRAVITY_DISTORTION_DRONE"    x="5" y="0" />
    <item name="ITEM_GRAVITY_DISTORTION_DRONE"    x="6" y="0" />
    <item name="ITEM_PLASMA_PISTOL"               x="0" y="1" />
    <item name="ITEM_PLASMA_PISTOL_CLIP"          x="2" y="3" />
  </loadout>
  <!-- What an X-Corp soldier comes equiped with -->
  <loadout name="XCorpDefault">
    <item name="ITEM_ASSAULT_RIFLE"           x="0" y="0" />
    <item name="ITEM_ASSAULT_RIFLE_CLIP"      x="4" y="0" />
    <item name="ITEM_ASSAULT_RIFLE_CLIP"      x="4" y="1" />
    <item name="ITEM_GRENADE"                 x="1" y="2" />
    <item name="ITEM_GRENADE"                 x="2" y="2" />
    <item name="ITEM_SMOKE_GRENADE"           x="2" y="3" />
    <item name="ITEM_SMOKE_GRENADE"           x="3" y="3" />
    <item name="ITEM_PROXIMITY_GRENADE"       x="0" y="1" />
    <item name="ITEM_SATCHEL_CHARGE"          x="2" y="0" />
    <item name="ITEM_SATCHEL_CHARGE"          x="0" y="3" />
    <item name="ITEM_STUN_BATON"              x="6" y="0" />
  </loadout>

  <loadout name="Ventriculant">
    <item name="ITEM_VENTRICULANT_WEAPON" x="0" y="0" />
  </loadout>
  <loadout name="Silabrate">
    <item name="ITEM_SILABRATE_WEAPON" x="0" y="0" />
  </loadout>
  <loadout name="Spawn">
    <item name="ITEM_SPAWN_WEAPON" x="0" y="0" />
  </loadout>
  <loadout name="Artopod">
    <item name="ITEM_ARTOPOD_WEAPON" x="0" y="0" />
  </loadout>
  <loadout name="Terrordisc">
    <item name="ITEM_TERRORDISC_WEAPON" x="0" y="0" />
  </loadout>
  <loadout name="Raptor">
    <item name="ITEM_RAPTOR_WEAPON" x="0" y="0" />
  </loadout>
  <loadout name="Zombie">
    <item name="ITEM_ZOMBIE_WEAPON" x="0" y="0" />
  </loadout>

  <armor id="None" front="0" side="0" rear="0" under = "0">
      <susceptibility damageType="Piercing"  physical="1.0" stun="0.25"/>
      <susceptibility damageType="Fire"      physical="1.0" stun="0.25"/>
      <susceptibility damageType="Explosive" physical="1.0" stun="0.25"/>
      <susceptibility damageType="Laser"     physical="1.0" stun="0.25"/>
      <susceptibility damageType="Plasma"    physical="1.0" stun="0.25"/>
      <susceptibility damageType="Stun"      physical="0.0" stun="1.00"/>
      <susceptibility damageType="Melee"     physical="1.2" stun="0.25"/>
      <susceptibility damageType="Acid"      physical="1.6" stun="0.25"/>
      <susceptibility damageType="Smoke"     physical="1.0" stun="0.25"/>
  </armor>
  <armor id="ITEM_COMBAT_ARMOR" front="50" side="40" rear="30" under = "30">
      <susceptibility damageType="Piercing"  physical="1.0" stun="0.25"/>
      <susceptibility damageType="Fire"      physical="1.0" stun="0.25"/>
      <susceptibility damageType="Explosive" physical="1.0" stun="0.25"/>
      <susceptibility damageType="Laser"     physical="1.0" stun="0.25"/>
      <susceptibility damageType="Plasma"    physical="1.0" stun="0.25"/>
      <susceptibility damageType="Stun"      physical="0.0" stun="1.00"/>
      <susceptibility damageType="Melee"     physical="1.0" stun="0.25"/>
      <susceptibility damageType="Acid"      physical="1.0" stun="0.25"/>
      <susceptibility damageType="Smoke"     physical="1.0" stun="0.25"/>
  </armor>
  <armor id="ITEM_COMBAT_POWERSUIT" front="100" side="80" rear="70" under = "60">
      <susceptibility damageType="Piercing"  physical="1.0" stun="0.25"/>
      <susceptibility damageType="Fire"      physical="1.0" stun="0.25"/>
      <susceptibility damageType="Explosive" physical="1.0" stun="0.25"/>
      <susceptibility damageType="Laser"     physical="1.0" stun="0.25"/>
      <susceptibility damageType="Plasma"    physical="1.0" stun="0.25"/>
      <susceptibility damageType="Stun"      physical="0.0" stun="1.00"/>
      <susceptibility damageType="Melee"     physical="1.0" stun="0.25"/>
      <susceptibility damageType="Acid"      physical="1.0" stun="0.25"/>
      <susceptibility damageType="Smoke"     physical="1.0" stun="0.25"/>
  </armor>
  <armor id="ITEM_ANTI_GRAV_POWERSUIT" front="110" side="90" rear="80" under = "70" flyer="true">
      <susceptibility damageType="Piercing"  physical="1.0" stun="0.25"/>
      <susceptibility damageType="Fire"      physical="1.0" stun="0.25"/>
      <susceptibility damageType="Explosive" physical="1.0" stun="0.25"/>
      <susceptibility damageType="Laser"     physical="1.0" stun="0.25"/>
      <susceptibility damageType="Plasma"    physical="1.0" stun="0.25"/>
      <susceptibility damageType="Stun"      physical="0.0" stun="1.00"/>
      <susceptibility damageType="Melee"     physical="1.0" stun="0.25"/>
      <susceptibility damageType="Acid"      physical="1.0" stun="0.25"/>
      <susceptibility damageType="Smoke"     physical="1.0" stun="0.25"/>
  </armor>
  <armor id="Satyrian" front="8" side="6" rear="4" under="12">
      <susceptibility damageType="Piercing"  physical="1.0" stun="0.125"/>
      <susceptibility damageType="Fire"      physical="1.0" stun="0.125"/>
      <susceptibility damageType="Explosive" physical="1.0" stun="0.125"/>
      <susceptibility damageType="Laser"     physical="1.0" stun="0.125"/>
      <susceptibility damageType="Plasma"    physical="1.0" stun="0.125"/>
      <susceptibility damageType="Stun"      physical="0.0" stun="1.00"/>
      <susceptibility damageType="Melee"     physical="1.2" stun="0.125"/>
      <susceptibility damageType="Acid"      physical="1.6" stun="0.125"/>
      <susceptibility damageType="Smoke"     physical="0.0" stun="0.125"/>
  </armor>
  <armor id="SatyrianLeader" front="16" side="12" rear="8" under="12">
      <susceptibility damageType="Piercing"  physical="1.0" stun="0.125"/>
      <susceptibility damageType="Fire"      physical="1.0" stun="0.125"/>
      <susceptibility damageType="Explosive" physical="1.0" stun="0.125"/>
      <susceptibility damageType="Laser"     physical="1.0" stun="0.125"/>
      <susceptibility damageType="Plasma"    physical="1.0" stun="0.125"/>
      <susceptibility damageType="Stun"      physical="0.0" stun="1.00"/>
      <susceptibility damageType="Melee"     physical="1.2" stun="0.125"/>
      <susceptibility damageType="Acid"      physical="1.6" stun="0.125"/>
      <susceptibility damageType="Smoke"     physical="0.0" stun="0.125"/>
  </armor>
  <armor id="SatyrianCommander" front="24" side="18" rear="12" under="16">
      <susceptibility damageType="Piercing"  physical="1.0" stun="0.125"/>
      <susceptibility damageType="Fire"      physical="1.0" stun="0.125"/>
      <susceptibility damageType="Explosive" physical="1.0" stun="0.125"/>
      <susceptibility damageType="Laser"     physical="1.0" stun="0.125"/>
      <susceptibility damageType="Plasma"    physical="1.0" stun="0.125"/>
      <susceptibility damageType="Stun"      physical="0.0" stun="1.00"/>
      <susceptibility damageType="Melee"     physical="1.2" stun="0.125"/>
      <susceptibility damageType="Acid"      physical="1.6" stun="0.125"/>
      <susceptibility damageType="Smoke"     physical="0.0" stun="0.125"/>
  </armor>

  <armor id="Grey" front="4" side="3" rear="2" under="2">
      <susceptibility damageType="Piercing"  physical="1.0" stun="0.125"/>
      <susceptibility damageType="Fire"      physical="1.0" stun="0.125"/>
      <susceptibility damageType="Explosive" physical="1.0" stun="0.125"/>
      <susceptibility damageType="Laser"     physical="1.0" stun="0.125"/>
      <susceptibility damageType="Plasma"    physical="1.0" stun="0.125"/>
      <susceptibility damageType="Stun"      physical="0.0" stun="1.00"/>
      <susceptibility damageType="Melee"     physical="1.2" stun="0.125"/>
      <susceptibility damageType="Acid"      physical="1.6" stun="0.125"/>